712982	FOTO I KAMERY	APARATY CYFROWE	APARAT CYFROWY PANASONIC DMC-FZ200EPK BLACK 12MPIX 24X FHD	3
735930	FOTO I KAMERY	APARATY CYFROWE	APARAT CYFROWY SONY DSC-HX300B BLACK 20MPIX 50X FHD	4
782595	FOTO I KAMERY	APARATY CYFROWE	APARAT CYFROWY SONY DSC-W810B BLACK 20MPIX 6X HD	5
782597	FOTO I KAMERY	APARATY CYFROWE	APARAT CYFROWY SONY DSC-W810S SILVER 20MPIX 8X HD	5
782598	FOTO I KAMERY	APARATY CYFROWE	APARAT CYFROWY SONY DSC-H300B BLACK 20MPIX 35X HD	5
783104	FOTO I KAMERY	APARATY CYFROWE	APARAT CYFROWY SONY DSC-W830B BLACK 20MPIX 8X HD	5
783495	FOTO I KAMERY	APARATY CYFROWE	APARAT CYFROWY SONY DSC-HX60B BLACK 20MPIX 30X FHD NFC WIFI	4
830162	FOTO I KAMERY	APARATY CYFROWE	APARAT CYFROWY NIKON COOLPIX L340 BLACK 20MPIX 28X HD	5
835615	FOTO I KAMERY	APARATY CYFROWE	APARAT CYFROWY PANASONIC DMC-SZ10EP-K BLACK 16MPIX 12X HD WIFI	4
850842	FOTO I KAMERY	APARATY CYFROWE	APARAT CYFROWY NIKON COOLPIX A10 SILVER 16MPIX 5X HD	2
850843	FOTO I KAMERY	APARATY CYFROWE	APARAT CYFROWY NIKON COOLPIX A10 BLACK 16MPIX 5X HD	2
854176	FOTO I KAMERY	APARATY CYFROWE	APARAT CYFROWY NIKON COOLPIX B500 BLACK 16MPIX 40X FHD WIFI	4
854181	FOTO I KAMERY	APARATY CYFROWE	APARAT CYFROWY NIKON COOLPIX A300 SILVER 20MPIX 8X HD WIFI	1
854247	FOTO I KAMERY	APARATY CYFROWE	APARAT CYFROWY CANON IXUS 175RE RED 20MPIX 8X HD	3
854248	FOTO I KAMERY	APARATY CYFROWE	APARAT CYFROWY CANON IXUS 175SL SILVER 20MPIX 8X HD	3
854250	FOTO I KAMERY	APARATY CYFROWE	APARAT CYFROWY CANON IXUS 180BL BLACK 20MPIX 10X HD NFC WIFI	3
783108	FOTO I KAMERY	APARATY HYBRYDOWE	APARAT CYFROWY SONY ILCE5000LB CZARNY + 16-50 WIFI NFC	4
785138	FOTO I KAMERY	APARATY HYBRYDOWE	APARAT CYFROWY SONY ILCE6000LB.CEC CZARNY WIFI NFC	4
790217	FOTO I KAMERY	APARATY HYBRYDOWE	APARAT CYFROWY OLYMPUS E-PL7 PANCAKE ZOOM KIT SREBRNY+EZ-M1442EZ SREBRNY	4
781405	FOTO I KAMERY	APARATY LUSTRZANKI	APARAT CYFROWY NIKON D5300 18-105mm VR KIT WIFI GPS	2
782778	FOTO I KAMERY	APARATY LUSTRZANKI	APARAT CYFROWY NIKON D3300 + 18-105 VR CZARNY	4
783324	FOTO I KAMERY	APARATY LUSTRZANKI	APARAT CYFROWY CANON EOS 1200D 18-55IIIDC	4
798548	FOTO I KAMERY	APARATY LUSTRZANKI	APARAT CYFROWY CANON EOS EOS 1200D 18-55+ TORBA 100EG + KARTA 8GB	5
858522	FOTO I KAMERY	APARATY LUSTRZANKI	APARAT CYFROWY CANON EOS 1300D 18-55 + 75-300 + PLECAK + SD 8GB + 100GB IRISTA	5
862192	FOTO I KAMERY	APARATY LUSTRZANKI	APARAT CYFROWY NIKON D3300 + 18-105VR+ KARTA SD 8GB + TORBA CF-EU11	1
862515	FOTO I KAMERY	APARATY LUSTRZANKI	APARAT CYFROWY CANON EOS 1300D 18-55 + TORBA 100EG + KARTA 8GB VUK	5
782599	FOTO I KAMERY	KAMERY	KAMERA CYFROWA SONY HDR-CX240EB CZARNY	5
830282	FOTO I KAMERY	KAMERY	KAMERA CYFROWA SONY HDR-CX405B CZARNY	5
830283	FOTO I KAMERY	KAMERY	KAMERA CYFROWA SONY HDR-PJ410B CZARNY	4
857345	FOTO I KAMERY	KAMERY	KAMERA CYFROWA JVC GZ-R415BEU CZARNA WODOODPORNA	5
792519	FOTO I KAMERY	KAMERY SPORTOWE	KAMERA SPORTOWA SONY HDR-AS20B	1
794108	FOTO I KAMERY	KAMERY SPORTOWE	GOPRO KAMERA SPORTOWA HERO4 BLACK ADVENTURE CHDHX-401-EU	3
831362	FOTO I KAMERY	KAMERY SPORTOWE	KAMERA SPORTOWA SONY HDR-AS200VR	4
838107	FOTO I KAMERY	KAMERY SPORTOWE	GOPRO KAMERA SPORTOWA HERO+ LCD CHDHB-101	5
839585	FOTO I KAMERY	KAMERY SPORTOWE	KAMERA SPORTOWA MANTA MM336 PRO WIFI	5
849537	FOTO I KAMERY	KAMERY SPORTOWE	KAMERA SPORTOWA MANTA MM333	5
851139	FOTO I KAMERY	KAMERY SPORTOWE	GOPRO KAMERA SPORTOWA HERO SESSION CHDHS-102	2
851141	FOTO I KAMERY	KAMERY SPORTOWE	KAMERA SPORTOWA MANTA MM357 4K 4FUN SPORTS WIFI CAMERA	5
852268	FOTO I KAMERY	KAMERY SPORTOWE	KAMERA SPORTOWA SONY HDR-AS50	3
861911	FOTO I KAMERY	KAMERY SPORTOWE	GOPRO KAMERA SPORTOWA HERO5 BLACK CHDHX-501	4
861912	FOTO I KAMERY	KAMERY SPORTOWE	GOPRO KAMERA SPORTOWA HERO5 SESSION CHDHS-501	4
